{
  "$schema": "../../../spec/rulepack.schema.json",
  "id": "de/zpo",
  "name": { "en": "Germany — civil procedure (ZPO § 222 with BGB §§ 187–188)", "de": "Deutschland — Zivilprozess (§ 222 ZPO i. V. m. §§ 187, 188 BGB)" },
  "jurisdiction": "DE",
  "calendar": "de",
  "calendar_family": "de",
  "status": "beta",
  "description": {
    "en": "Court time limits (Fristen) under § 222 ZPO: the day of service is not counted (§ 187(1) BGB); weeks and months end on the corresponding day, or on the last day of a shorter month (§ 188 BGB); a period ending on a Saturday, Sunday or general public holiday ends at the end of the next working day (§ 222(2) ZPO). Holidays at the place where the document must be filed apply, so pass calendar='de-<Land>' (e.g. 'de-nw', 'de-by-catholic').",
    "de": "Gerichtliche Fristen nach § 222 ZPO: der Tag der Zustellung wird nicht mitgerechnet (§ 187 Abs. 1 BGB); Wochen- und Monatsfristen enden mit dem entsprechenden Tag bzw. dem letzten Tag eines kürzeren Monats (§ 188 BGB); fällt das Ende auf einen Sonnabend, Sonntag oder allgemeinen Feiertag, endet die Frist mit Ablauf des nächsten Werktages (§ 222 Abs. 2 ZPO). Maßgeblich sind die Feiertage am Ort, an dem der Schriftsatz einzureichen ist: calendar='de-<Land>' angeben (z. B. 'de-nw', 'de-by-catholic')."
  },
  "disclaimer": {
    "en": "Informational tool, not legal advice. Check the statute, case law and the court's practice before relying on a result.",
    "de": "Unverbindliches Hilfsmittel, keine Rechtsberatung. Vor Verwendung Gesetz, Rechtsprechung und Gerichtspraxis prüfen."
  },
  "citations": {
    "zpo_222_1": {
      "label": { "en": "ZPO § 222(1) with BGB §§ 187(1), 188", "de": "§ 222 Abs. 1 ZPO i. V. m. §§ 187 Abs. 1, 188 BGB" },
      "url": "https://www.gesetze-im-internet.de/bgb/__188.html",
      "quote": { "de": "§ 187 Abs. 1 BGB: Ist für den Anfang einer Frist ein Ereignis oder ein in den Lauf eines Tages fallender Zeitpunkt maßgebend, so wird bei der Berechnung der Frist der Tag nicht mitgerechnet, in welchen das Ereignis oder der Zeitpunkt fällt. § 188 Abs. 2 BGB: Eine Frist, die nach Wochen, nach Monaten … bestimmt ist, endigt im Falle des § 187 Abs. 1 mit dem Ablauf desjenigen Tages der letzten Woche oder des letzten Monats, welcher durch seine Benennung oder seine Zahl dem Tage entspricht, in den das Ereignis … fällt. § 188 Abs. 3 BGB: Fehlt bei einer nach Monaten bestimmten Frist in dem letzten Monat der für ihren Ablauf maßgebende Tag, so endigt die Frist mit dem Ablauf des letzten Tages dieses Monats." }
    },
    "zpo_222_2": {
      "label": { "en": "ZPO § 222(2)", "de": "§ 222 Abs. 2 ZPO" },
      "url": "https://www.gesetze-im-internet.de/zpo/__222.html",
      "quote": { "de": "Fällt das Ende einer Frist auf einen Sonntag, einen allgemeinen Feiertag oder einen Sonnabend, so endet die Frist mit Ablauf des nächsten Werktages." }
    },
    "zpo_130a_5": {
      "label": { "en": "ZPO § 130a(5)", "de": "§ 130a Abs. 5 ZPO" },
      "url": "https://www.gesetze-im-internet.de/zpo/__130a.html",
      "quote": { "de": "Ein elektronisches Dokument ist eingegangen, sobald es auf der für den Empfang bestimmten Einrichtung des Gerichts gespeichert ist." }
    },
    "zpo_517_520": {
      "label": { "en": "ZPO §§ 517, 520(2), 548, 551(2)", "de": "§§ 517, 520 Abs. 2, 548, 551 Abs. 2 ZPO" },
      "url": "https://www.gesetze-im-internet.de/zpo/__517.html",
      "quote": { "de": "§ 517 ZPO: … beginnt mit der Zustellung des in vollständiger Form abgefassten Urteils, spätestens aber mit dem Ablauf von fünf Monaten nach der Verkündung." }
    },
    "bgh_vi_za_27_11": {
      "label": { "en": "BGH, decision of 10 January 2012, VI ZA 27/11", "de": "BGH, Beschluss vom 10. Januar 2012, VI ZA 27/11" },
      "url": "https://www.bundesgerichtshof.de/SharedDocs/Entscheidungen/DE/Zivilsenate/VI_ZS/2011/VI_ZA__27-11.pdf?__blob=publicationFile&v=1",
      "quote": { "de": "… wenn der betreffende Tag an dem Ort, wo das Rechtsmittel einzulegen ist, gesetzlicher Feiertag ist." }
    }
  },
  "steps": [
    { "type": "count", "cite": "zpo_222_1" },
    { "type": "roll", "cite": "zpo_222_2" },
    { "type": "ends_at", "time": "23:59", "cite": "zpo_130a_5" },
    {
      "type": "notice", "code": "court-seat-holidays", "cite": "bgh_vi_za_27_11",
      "text": {
        "en": "Holidays at the place where the document must be filed decide (BGH VI ZA 27/11): for Berufung and its grounds the appellate court (§§ 519(1), 520(3) ZPO), for Revision the BGH in Karlsruhe ('de-bw'), for Einspruch the trial court (§ 340(1) ZPO). Use that court's Land or municipality calendar (e.g. 'de-by-catholic' for Munich, 'de-by-augsburg' for the city of Augsburg).",
        "de": "Maßgeblich sind die Feiertage am Ort, an dem der Schriftsatz einzureichen ist (BGH VI ZA 27/11): bei Berufung und Berufungsbegründung das Berufungsgericht (§§ 519 Abs. 1, 520 Abs. 3 ZPO), bei Revision der BGH in Karlsruhe ('de-bw'), beim Einspruch das Prozessgericht (§ 340 Abs. 1 ZPO). Kalender dieses Gerichtsorts verwenden (z. B. 'de-by-catholic' für München, 'de-by-augsburg' für die Stadt Augsburg)."
      }
    },
    {
      "type": "notice", "code": "five-month-cap", "cite": "zpo_517_520",
      "when": { "unit": "month" },
      "text": {
        "en": "Berufung, Revision and their grounds (§§ 517, 520(2), 548, 551(2) ZPO) start on service of the full judgment, but at the latest five months after pronouncement. If service came later or never, the real deadline is earlier than shown.",
        "de": "Berufungs-, Revisions- und Begründungsfristen (§§ 517, 520 Abs. 2, 548, 551 Abs. 2 ZPO) beginnen mit Zustellung des vollständigen Urteils, spätestens aber mit Ablauf von fünf Monaten nach der Verkündung. Bei späterer oder fehlender Zustellung endet die Frist früher als angezeigt."
      }
    }
  ]
}
